item_id,item_name,item_type,nutrition_flag,wartość,kcal,fat,saturated_fat,carbohydrates,sugar,fiber,protein,salt
0000013530,Głodniaki Parówki z filetem z indyka 140 g,mieso,Y,w porcji 100 g,202 kcal,15 g,4.6 g,1.7 g,1.7 g,0.4 g,15 g,1.7 g
0000008818,Kraina Wędlin Szynka krucha zawędzana 160 g,mieso,Y,w porcji 100 g,111 kcal,3 g,1.2 g,1.1 g,1 g,0 g,20 g,2.1 g
0000006605,Głodniaki Kabanoski z szynki 75g,mieso,Y,w porcji 100 g,410 kcal,30 g,5.5 g,2 g,1 g,,32 g,1.9 g
0000016759,Morliny Ślązerki ser- pomidor 240 g,mieso,Y,w porcji 100 g,284 kcal,24 g,9.6 g,2 g,1 g,,15 g,2.6 g
0000006747,Kraina Wędlin Salceson wieprzowy parzony 300 g,mieso,Y,w porcji 100 g,176 kcal,11 g,4 g,3.9 g,0.5 g,0.8 g,15 g,1.7 g
0000001618,Czas na grill Boczek rolowany marynata klasyczna 300 g,mieso,Y,w porcji 100 g,325 kcal,30 g,12 g,1.6 g,0.6 g,0.2 g,12 g,1.3 g
0000006606,Głodniaki Kabanoski z szynki wieprzowej i indyka 75g,mieso,Y,w porcji 100 g,379 kcal,27 g,5.5 g,3 g,1 g,,30 g,1.9 g
0000014248,Kraina Mięs Żołądki z gęsi po staropolsku 400 g,mieso,Y,w porcji 100 g,110 kcal,2.5 g,0.8 g,1 g,0.9 g,0.5 g,21 g,1.4 g
