item_id,item_name,item_type,nutrition_flag,wartość,kcal,fat,saturated_fat,carbohydrates,sugar,fiber,protein,salt
0000015096,Nasza Spiżarnia Różowa surówka słodko-kwaśna 480 g,dania-gotowe,Y,w porcji 100 g,78 kcal,2.3 g,0 g,12.5 g,12.5 g,1.7 g,1 g,1.4 g
0000009118,Nasze Smaki Pyzy z mięsem 700 g,dania-gotowe,Y,w porcji 100 g,167 kcal,4.1 g,1.7 g,26 g,0.5 g,2.7 g,4.6 g,0.6 g
0000004603,El Toro Rojo Panini z szynką i serem 240 g,dania-gotowe,Y,w porcji 100 g,248 kcal,8.2 g,4.3 g,29.4 g,1.7 g,1.7 g,14.2 g,1.5 g
0000010553,Jadłowiec Danie Curry kurczak z ryżem 350 g,dania-gotowe,Y,w porcji 100 g,148 kcal,4.3 g,0.4 g,22.3 g,4 g,0.8 g,4.7 g,0.45 g
0000010552,Jadłowiec Danie śmietanowo - grzybowy kurczak z kaszą gryczaną 350 g,dania-gotowe,Y,w porcji 100 g,148 kcal,5.4 g,0.8 g,16.6 g,2 g,4 g,6.2 g,0.44 g
0000004108,Danie Express Mini naleśniki 300g,dania-gotowe,Y,w porcji 100 g,350 kcal,19 g,8.5 g,40 g,17 g,0.9 g,5.8 g,0.85 g
0000007939,Nasze Smaki Sałatka warzywna z groszkiem bez konserwantów 500g,dania-gotowe,Y,w porcji 100 g,242 kcal,22.7 g,2.8 g,6.7 g,4.2 g,1.5 g,2 g,1.4 g
0000007940,Nasze Smaki Sałatka warzywna z jajkiem bez konserwantów 500g,dania-gotowe,Y,w porcji 100 g,254 kcal,24.7 g,2.1 g,5.2 g,5.2 g,1 g,2.3 g,1.3 g
